<?xml version="1.0" encoding="UTF-8"?>
<TrafficAndTravelNewsData xmlns="http://www.transportdirect.info/travelnews" xmlns:xsi="http://www.w3.org/2001/XMLSchema-instance" xsi:schemaLocation="http://www.transportdirect.info/travelnews TravelNews.xsd" version="IF00908">
  <Incident uid="RTM3715583" parent_uid="0" incident_change_status="Unchanged" severity="Severe" carriageway_direction="Southbound" road_number="M6" incidentType="Closures and Lane Restrictions" modeOfTransport="Road" location="M6 Lancashire" incidentStatus="O" roadType="M" headlineText="M6 : Restriction Southbound at J27" detailText="Lane closed southbound between J27, Standish and J26, Orrell Interchange, slow traffic." reportedDatetime="2010-05-27T15:29:48" lastModifiedDatetime="2010-05-27T16:07:29" startDatetime="2010-05-27T15:29:48" expiryDatetime="2010-05-27T16:47:05" daily_startDatetime="00:00:00" daily_endDatetime="23:59:59" daymask="SuMoTuWeThFrSa" plannedIncident="false" easting="354138" northing="410580">
    <Region uid="RTM3715583" regionName="North West"/>
    <IncidentDataSource>Government Agency (86)</IncidentDataSource>
    <TOIDsAffected>
      <TOIDAffected>4000000009205515</TOIDAffected>
      <TOIDAffected>4000000009205517</TOIDAffected>
      <TOIDAffected>4000000009212484</TOIDAffected>
      <TOIDAffected>4000000009212496</TOIDAffected>
      <TOIDAffected>4000000009212511</TOIDAffected>
      <TOIDAffected>4000000009212512</TOIDAffected>
      <TOIDAffected>4000000009212519</TOIDAffected>
      <TOIDAffected>4000000009289717</TOIDAffected>
      <TOIDAffected>4000000009289718</TOIDAffected>
      <TOIDAffected>4000000009289724</TOIDAffected>
    </TOIDsAffected>
  </Incident>
  <Incident uid="RTM3695954" parent_uid="0" incident_change_status="Amended" severity="Slight" carriageway_direction="both ways" road_number="" incidentType="Cleared" modeOfTransport="Road" location="Mitford Street Filey, North Yorkshire" incidentStatus="C" roadType="U" headlineText="Filey: Road re-opened at Mitford Street" detailText="Road re-opened on Mitford Street both ways at the Chapel Street junction in Filey.. Until 1st June" reportedDatetime="2010-05-17T10:54:31" lastModifiedDatetime="2010-05-27T16:09:31" startDatetime="2010-05-24T00:00:00" expiryDatetime="2010-05-27T23:59:00" daily_startDatetime="00:00:00" daily_endDatetime="23:59:59" daymask="SuMoTuWeThFrSa" plannedIncident="false" easting="511697" northing="480818">
    <Region uid="RTM3695954" regionName="Yorkshire and Humber"/>
    <IncidentDataSource>Local Authority (19)</IncidentDataSource>
    <TOIDsAffected>
      <TOIDAffected>4000000026503226</TOIDAffected>
      <TOIDAffected>4000000026579089</TOIDAffected>
    </TOIDsAffected>
  </Incident>
  <Incident uid="RTM3709737" parent_uid="0" incident_change_status="Unchanged" severity="Medium" carriageway_direction="both ways" road_number="A3212" incidentType="Closures/ blockages" modeOfTransport="Road" location="A3212 Westminster, London" incidentStatus="O" roadType="A" headlineText="A3212 : Road closed at Westminster" detailText="Millbank closed both ways between the A3203 junction and the A302 junction in Westminster, following Tuesdays State Opening of Parliament. Until 6:00 on 28th May" reportedDatetime="2010-05-25T05:27:58" lastModifiedDatetime="2010-05-27T13:59:35" startDatetime="2010-05-25T00:00:00" expiryDatetime="2010-05-28T07:30:00" daily_startDatetime="00:00:00" daily_endDatetime="23:59:59" daymask="SuMoTuWeThFrSa" plannedIncident="false" easting="530245" northing="178973">
    <Region uid="RTM3709737" regionName="London"/>
    <IncidentDataSource>Camera (16)</IncidentDataSource>
    <TOIDsAffected>
      <TOIDAffected>4000000030099833</TOIDAffected>
      <TOIDAffected>4000000030237969</TOIDAffected>
      <TOIDAffected>4000000030237970</TOIDAffected>
      <TOIDAffected>4000000030237971</TOIDAffected>
      <TOIDAffected>4000000030237974</TOIDAffected>
      <TOIDAffected>4000000030417958</TOIDAffected>
      <TOIDAffected>4000000030418101</TOIDAffected>
      <TOIDAffected>4000000030418102</TOIDAffected>
      <TOIDAffected>4000000030418104</TOIDAffected>
      <TOIDAffected>4000000030458831</TOIDAffected>
      <TOIDAffected>4000000030458832</TOIDAffected>
    </TOIDsAffected>
  </Incident>
  <Incident uid="RTM3714052" parent_uid="0" incident_change_status="Unchanged" severity="Medium" carriageway_direction="None" road_number="A100" incidentType="Closures and Lane Restrictions" modeOfTransport="Road" location="A100 City Of London, London" incidentStatus="O" roadType="A" headlineText="A100 : Closure at City Of London" detailText="Bridge due to open at 16:45 and 18:00 on Tower Bridge Approach at the Tower Hill junction in City Of London, delays expected. Until 18:20 on 27th May" reportedDatetime="2010-05-27T05:47:28" lastModifiedDatetime="2010-05-27T16:08:57" startDatetime="2010-05-27T00:00:00" expiryDatetime="2010-05-27T16:50:00" daily_startDatetime="00:00:00" daily_endDatetime="23:59:59" daymask="SuMoTuWeThFrSa" plannedIncident="false" easting="533774" northing="180682">
    <Region uid="RTM3714052" regionName="London"/>
    <IncidentDataSource>Camera (16)</IncidentDataSource>
    <TOIDsAffected>
      <TOIDAffected>4000000030345773</TOIDAffected>
      <TOIDAffected>4000000030459778</TOIDAffected>
      <TOIDAffected>4000000030459779</TOIDAffected>
      <TOIDAffected>4000000031066867</TOIDAffected>
    </TOIDsAffected>
  </Incident>
  <Incident uid="RTM3714151" parent_uid="0" incident_change_status="Unchanged" severity="Medium" carriageway_direction="Westbound" road_number="A12" incidentType="Congestion" modeOfTransport="Road" location="A12 Ilford, Greater London" incidentStatus="O" roadType="A" headlineText="A12 : Congestion at Ilford" detailText="Queueing traffic on Eastern Avenue westbound at the Gants Hill Roundabout junction in Ilford." reportedDatetime="2010-05-27T06:08:09" lastModifiedDatetime="2010-05-27T15:46:25" startDatetime="2010-05-27T06:08:09" expiryDatetime="2010-05-27T16:26:25" daily_startDatetime="00:00:00" daily_endDatetime="23:59:59" daymask="SuMoTuWeThFrSa" plannedIncident="false" easting="543287" northing="188426">
    <Region uid="RTM3714151" regionName="London"/>
    <IncidentDataSource>Camera (16)</IncidentDataSource>
    <TOIDsAffected>
      <TOIDAffected>4000000030361667</TOIDAffected>
      <TOIDAffected>4000000031045989</TOIDAffected>
    </TOIDsAffected>
  </Incident>
  <Incident uid="RTM3714045" parent_uid="0" incident_change_status="Unchanged" severity="Medium" carriageway_direction="Westbound" road_number="A315" incidentType="Closures and Lane Restrictions" modeOfTransport="Road" location="A315 Knightsbridge, London" incidentStatus="O" roadType="A" headlineText="A315 : Restriction at Knightsbridge" detailText="One lane closed westbound at the Scotch Corner junction in Knightsbridge, slow traffic." reportedDatetime="2010-05-27T05:39:44" lastModifiedDatetime="2010-05-27T15:46:26" startDatetime="2010-05-27T05:39:44" expiryDatetime="2010-05-27T16:26:26" daily_startDatetime="00:00:00" daily_endDatetime="23:59:59" daymask="SuMoTuWeThFrSa" plannedIncident="false" easting="527778" northing="179695">
    <Region uid="RTM3714045" regionName="London"/>
    <IncidentDataSource>Government Agency (71)</IncidentDataSource>
    <TOIDsAffected>
      <TOIDAffected>4000000030960564</TOIDAffected>
      <TOIDAffected>4000000030960565</TOIDAffected>
    </TOIDsAffected>
  </Incident>
  <Incident uid="RTM3714041" parent_uid="0" incident_change_status="Unchanged" severity="Slight" carriageway_direction="both ways" road_number="" incidentType="Delays" modeOfTransport="Road" location="Torpoint Ferry Plymouth, Devon" incidentStatus="O" roadType="U" headlineText="Plymouth: Delays at Tamar Wharf" detailText="Waiting times of up to ten minutes on Tamar Wharf both ways between the A374 Pottery Road junction and the A374 junction in Plymouth, three ferries running." reportedDatetime="2010-05-27T05:32:25" lastModifiedDatetime="2010-05-27T15:56:39" startDatetime="2010-05-27T05:32:25" expiryDatetime="2010-05-27T16:36:39" daily_startDatetime="00:00:00" daily_endDatetime="23:59:59" daymask="SuMoTuWeThFrSa" plannedIncident="false" easting="244875" northing="55154">
    <Region uid="RTM3714041" regionName="South West"/>
    <IncidentDataSource>Operator (25)</IncidentDataSource>
    <TOIDsAffected></TOIDsAffected>
  </Incident>
  <Incident uid="RTM3710805" parent_uid="0" incident_change_status="Unchanged" severity="Medium" carriageway_direction="Westbound" road_number="A406" incidentType="Closures/ blockages" modeOfTransport="Road" location="A406 Brent Cross, Greater London" incidentStatus="O" roadType="A" headlineText="A406 : Slip road closed at Brent Cross" detailText="Exit slip road closed on North Circular Road westbound at the Brent Cross Flyover junction in Brent Cross, earlier building fire at a derelict property. Diversion in operation." reportedDatetime="2010-05-25T12:08:16" lastModifiedDatetime="2010-05-27T16:08:35" startDatetime="2010-05-25T12:08:16" expiryDatetime="2010-05-27T16:48:35" daily_startDatetime="00:00:00" daily_endDatetime="23:59:59" daymask="SuMoTuWeThFrSa" plannedIncident="false" easting="523556" northing="187934">
    <Region uid="RTM3710805" regionName="London"/>
    <IncidentDataSource>Camera (16)</IncidentDataSource>
    <TOIDsAffected>
      <TOIDAffected>4000000030225259</TOIDAffected>
    </TOIDsAffected>
  </Incident>